{
  "event_id": "rev-question-id-editorial-v1-reviewer-date",
  "question_id": "replace-with-question-id",
  "question_version": 1,
  "content_digest": "sha256:replace-with-generated-digest",
  "review_type": "editorial",
  "decision": "changes_requested",
  "reviewer": {
    "id": "replace-with-reviewer-id",
    "display_name": "Replace with reviewer name",
    "role_note": "Describe educational editing, technical writing, accessibility, or content-review role"
  },
  "reviewed_at": "2026-08-02T00:00:00Z",
  "confidence": "medium",
  "checklist": {
    "stem_clear_complete": false,
    "one_defined_task": false,
    "options_parallel": false,
    "options_plausible": false,
    "no_answer_cueing": false,
    "negative_wording_controlled": false,
    "style_consistent": false,
    "learner_centered_rationales": false,
    "reading_load_appropriate": false,
    "accessible_language": false,
    "scientific_meaning_unchanged": false
  },
  "verified_references": [],
  "comments": "Record required revisions or approval notes for this exact version and digest.",
  "issue_codes": ["review_not_complete"],
  "supersedes_event_id": null
}
